"Authors","Year","Title","Journal","Volume","Issue","DOI"
"Harris M.","2019","A Future for planning: Taking responsibility for twenty-first century challenges","A Future for Planning: Taking Responsibility for Twenty-First Century Challenges","","","10.4324/9781315201092"
"Nie R., Zhang M., Song Y., Chen S., Ding Y.","2023","Study on China's energy system resilience under the scenarios of long-term shortage of imported oil","Energy","270","","10.1016/j.energy.2023.126831"
"Sabbatani S., Fiorino S.","2007","The ""Spanish influenza"" pandemic [La pandemia influenzale ""spagnola""]","Infezioni in Medicina","15","4",""
"Bishop C.A.","2007","The old Bishop's Almanac prognostications for the future of vacuum coating - 2007","Association of Industrial Metallizers, Coaters and Laminators - Fall Technical Conf. of the Association of Industrial Metallizers, Coaters and Laminators 2007 and 21st Int. Vacuum Web Coating Conf.","2","",""
"Wilson A., Orlove B., Adelekan I., Dawson N., Sanago G., Coen D., Nelson M.K., Carmona R., Rubis J., Reyes-García V., Alangui W., Sherpa P.","2023","Placing diverse knowledge systems at the core of transformative climate research","Ambio","","","10.1007/s13280-023-01857-w"
"Scolobig A., Fraser A., Mavrogenis S., Pelling M.","2020","Relating root causes to local risk conditions: A comparative study of the institutional pathways to small-scale disasters in three urban flood contexts","Global Environmental Change","63","","10.1016/j.gloenvcha.2020.102102"
"Ndiritu M.K., O'Sullivan S.C.","2015","Young proffessionals and students involvement in disaster risk reduction using space technology approaches","Proceedings of the International Astronautical Congress, IAC","14","",""
"Tiong R.L.K., Qian Q.Y.","2008","Catastrophic risk of PPP infrastructure systems","EASEC-11 - Eleventh East Asia-Pacific Conference on Structural Engineering and Construction","","",""
"Pawłowski A.","2020","Covid-19, environmental engineering and the end of the world as we know it","Problemy Ekorozwoju","15","2",""
"Feizinejad M., Mohammadiha A., Malakooti H.","2016","Aannual numerical simulation of the radionuclidal atmospheric dispersion and optimized monitoring network design for BNPP-1","Journal of Environmental Studies","42","3",""
"Liu R.R., Jiang W.J., Jia C.X.","2020","Depth Penetration and Scope Extension of Failures in the Cascading of Multilayer Networks","Complexity","2020","","10.1155/2020/3578736"
"Mangrum B.","2013","Accounting for the road: Tragedy, courage, and ca vell's acknowledgment","Philosophy and Literature","37","2","10.1353/phl.2013.0033"
"Stergiou A.","2023","Eastern Mediterranean Energy Geopolitics Revisited: Green Economy Instead of Conflict","Journal of Balkan and Near Eastern Studies","","","10.1080/19448953.2023.2167163"
"Evans N.","2020","What Ought to Be Done to Promote Education for Sustainability in Teacher Education?","Journal of Philosophy of Education","","","10.1111/1467-9752.12482"
"Zaverucha G., Orlandi C., Takahashi A., Aranha D.F.","2020","Security of hedged fiat–shamir signatures under fault attacks","Lecture Notes in Computer Science (including subseries Lecture Notes in Artificial Intelligence and Lecture Notes in Bioinformatics)","12105 LNCS","","10.1007/978-3-030-45721-1_23"
"Jiang W., Jin L., Dai J., Cao K.","2023","Who Needs to Save Energy and Reduce Emissions? Perspective of Energy Misallocation and Economies of Scale","International Journal of Environmental Research and Public Health","20","3","10.3390/ijerph20031680"
"Priyadharshini E.","2019","Anticipating the apocalypse: Monstrous educational futures","Futures","113","","10.1016/j.futures.2019.102453"
"Lewis J., Feiler D., Adner R.","2023","The Worst-First Heuristic: How Decision Makers Manage Conjunctive Risk","Management Science","69","3","10.1287/mnsc.2022.4411"
"Schelhase M.","2023","‘Reason is just one letter away from treason’: Exploring Risk in Defence Procurement","International Political Economy Series","","","10.1007/978-3-031-11968-2_4"
"Markmann C., Darkow I.-L., von der Gracht H.","2013","A Delphi-based risk analysis - Identifying and assessing future challenges for supply chain security in a multi-stakeholder environment","Technological Forecasting and Social Change","80","9","10.1016/j.techfore.2012.10.019"
"Pittore M., Wieland M.","2013","Toward a rapid probabilistic seismic vulnerability assessment using satellite and ground-based remote sensing","Natural Hazards","68","1","10.1007/s11069-012-0475-z"
"Case-Winters A.","2016","The end? Christian eschatology and the end of the world","Interpretation (United Kingdom)","70","1","10.1177/0020964315603351"
"Modregger J., Jaeger K.E., Van Logchem M., Wieland S., Golyshin P.N., Shahgaldian P., De Carvalho C.C.C.R., Ansari N., Timm A., Streit W.R., Lottenbach R., Ferrer M., Re I., Robles-Martín A., Corvini P., Guallar V., Thies S., Yakimov M.M., Beltrametti F., Chow J., Sanz-Aparicio J., Müller M., Daniotti S., Rösch R., Molina-Espeja P., Degering C.","2023","Enzymes for consumer products to achieve climate neutrality","Oxford Open Climate Change","3","1","10.1093/oxfclm/kgad003"
"Edmonds C., Noy I.","2019","Increasing fiscal resilience to disasters in the Pacific","Natural Hazards","97","3","10.1007/s11069-019-03719-9"
"Stefánsson H.O.","2023","Erratum: Continuity and catastrophic risk (Economics and Philosophy (2021) DOI: 10.1017/S0266267121000146)","Economics and Philosophy","","","10.1017/S0266267123000081"
"Sleat M.","2019","Hoping for an apocalypse? Political Realism in Apocalyptic Times by Alison McQueen","European Journal of Political Theory","","","10.1177/1474885119886554"
"Tang A.","2023","The Slippery Slopes of Climate Engineering Research","Global Environmental Change","80","","10.1016/j.gloenvcha.2023.102674"
"Effendie A.R., Sari D.P., Danardono None, Rosadi D.","2019","K-means and bayesian networks to determine building damage levels","Telkomnika (Telecommunication Computing Electronics and Control)","17","2","10.12928/TELKOMNIKA.V17I2.11756"
"Solovyeva A., Hynek N.","2023","When stigmatization does not work: over-securitization in efforts of the Campaign to Stop Killer Robots","AI and Society","","","10.1007/s00146-022-01613-w"
"Cova V.","2023","Thinking the End: Desiring Death and the Undead in the Ecuadorian Upper Amazon","Ethnos","88","1","10.1080/00141844.2020.1867607"
"Maher M.L., Rezwana J.","2023","User Perspectives on Ethical Challenges in Human-AI Co-Creativity: A Design Fiction Study","ACM International Conference Proceeding Series","","","10.1145/3591196.3593364"
"Balistreri M.","2023","SHOULD POSTHUMAN BE (HUMAN)- ENHANCEMENT BASED? THE POSTHUMAN PROJECT IN THE AGE OF CLIMATE CHANGE AND SPACE TRAVELLING","Etica e Politica","25","1","10.13137/1825-5167/34683"
"Birkmann J.","2007","Risk and vulnerability indicators at different scales:. Applicability, usefulness and policy implications","Environmental Hazards","7","1","10.1016/j.envhaz.2007.04.002"
"Latimer C.E., Crossley M.S., Snyder W.E., Kennedy C.M.","2023","Past and recent farming degrades aquatic insect genetic diversity","Molecular Ecology","32","13","10.1111/mec.16590"
"Dari-Mattiacci G., Faure M.G.","2015","The Economics of Disaster Relief","Law and Policy","37","3","10.1111/lapo.12036"
"Wenzel H., Askegaard S., Nøjgaard M., Cimpan C., Smaniotto C., Zhilyaev D.","2020","How the dead storage of consumer electronics creates consumer value","Sustainability (Switzerland)","12","14","10.3390/su12145552"
"Osmundsen M., Petersen M.B., Aarøe L.","2016","Distrust as a disease avoidance strategy: Individual differences in disgust sensitivity regulate generalized social trust","Frontiers in Psychology","7","JUL","10.3389/fpsyg.2016.01038"
"Rajesh Kanna S.K., Sivasankar P., Mohanakrishnan M., Raghul Khanna C.K., Lingaraj N.","2019","Optimizing Headlamp Focusing Through Intelligent System as Safety Assistance in Automobiles","Lecture Notes in Mechanical Engineering","","","10.1007/978-981-13-6374-0_59"
"Simon J.","2008","War on!: Why a 'war on cancer' should replace our 'war on crime' (and terror)","European Journal of Cultural Studies","11","3","10.1177/1367549408091848"
"Jackson J.C.","1998","Age crises, scalar fields, and the apocalypse","Modern Physics Letters A","13","21",""
"Northcott R.","2016","A Dilemma for the Doomsday Argument","Ratio","29","3","10.1111/rati.12104"
"Lauta K.C.","2014","New fault lines? On responsibility and disasters","European Journal of Risk Regulation","5","2",""
"Buller T.","2013","Neurotechnology, invasiveness and the extended mind","Neuroethics","6","3","10.1007/s12152-011-9133-5"
"Thu P.A., Hamad A.K., Alhadidi A.A., Sial M.S., Mohammad S.J., Borgi H.","2020","How artificial intelligence changes the future of accounting industry","International Journal of Economics and Business Administration","8","3","10.35808/ijeba/538"
"Lustig H., Fleckenstein M., Longstaff F.A.","2017","Deflation risk","Review of Financial Studies","30","8","10.1093/rfs/hhx021"
"Subramanian P., Setyaji P.","2020","Semi supervised learning to classify drug resistant tuberculosis","International Journal of Current Research and Review","12","19","10.31782/IJCRR.2020.121920"
"Beichman A.","2023","Anti-American Myths: Their Causes and Consequences","Anti-American Myths: Their Causes and Consequences","","","10.4324/9781003423454"
"Atkinson D.","2020","Language at the end of the world: Beckett and eco-deconstruction","Samuel Beckett Today - Aujourd'hui","32","2","10.1163/18757405-03202006"
"Chyba C.F., Thomas P.J., Zahnle K.J.","1993","The 1908 Tunguska explosion: Atmospheric disruption of a stony asteroid","Nature","361","6407",""
"Washington H., Roser D., Diesendorf M.","2023","Analyzing the Nuclear Weapons Proliferation Risk Posed by a Mature Fusion Technology and Economy","Energies","16","3","10.3390/en16031123"
"Meagher J.P.","1988","Environmental protection and industries in developing countries: the case of India after Bhopal","Urban Law & Policy","9","5",""
"Gandy M.","2023","Zoonotic urbanisation: multispecies urbanism and the rescaling of urban epidemiology","Urban Studies","","","10.1177/00420980231154802"
"Pathak G., Nichter M.","2023","Navigating Crises of Scale in the Anthropocene A Note to Engaged Anthropologists","Anthropology in Action","30","1","10.3167/aia.2023.300103"
"Olusegun O.O., Olubiyi I.A.","2017","Implications of Genetically Modified Crops and Intellectual Property Rights on Agriculture in Developing Countries","Journal of African Law","61","2","10.1017/S0021855317000134"
"Brevini B.","2023","Artificial Intelligence, Artificial Solutions: Placing the Climate Emergency at the Center of AI Developments","Technology and Sustainable Development: The Promise and Pitfalls of Techno-Solutionism","","","10.1201/9781003325086-3"
"Vashlaeva N., Kontorovich A.E., Tchernook V.A., Minin V.A., Kuznetsov F.A., Kurlenya M.V., Rostovtsev V.I., Sharov G.N., Gritsko G.I., Kozlovsky E.A., Belozerov I.M., Kovalev V.A.","2019","Gas explosion hazard in underground coal mining in Kuzbass","IOP Conference Series: Earth and Environmental Science","262","1","10.1088/1755-1315/262/1/012036"
"Suzuki Y.k., Wei Z., Sato M., Kanda H., Takayanagi T.","2023","AdS/BCFT with brane-localized scalar field","Journal of High Energy Physics","2023","3","10.1007/JHEP03(2023)105"
"Webster J.","2020","Embodied apocalypse: or the native cosmology of late modern social theory","Anthropology and Medicine","","","10.1080/13648470.2020.1807727"
"Bier V.","2020","The Role of Decision Analysis in Risk Analysis: A Retrospective","Risk Analysis","","","10.1111/risa.13583"
"Airlangga E., Akrim A.","2020","Learning from COVID-19, will this pandemic reappear: A reflection for indonesian children future","Systematic Reviews in Pharmacy","11","6","10.31838/srp.2020.6.144"
"Pedroza G., Adedjouma M.","2019","Safe-by-design development method for artificial intelligent based systems","Proceedings of the International Conference on Software Engineering and Knowledge Engineering, SEKE","2019-July","","10.18293/SEKE2019-094"
"Tan S., Rudolph J.","2023","ChatGPT: Bullshit spewer or the end of traditional assessments in higher education?","Journal of Applied Learning and Teaching","6","1","10.37074/jalt.2023.6.1.9"
"Guerrero Delgado M.C., Sánchez Ramos J., Álvarez Domínguez S.","2020","Using the sky as heat sink: Climatic applicability of night-sky based natural cooling techniques in Europe","Energy Conversion and Management","225","","10.1016/j.enconman.2020.113424"
"Sun L.G., Daniels B.","2014","Mirrored externalities","Notre Dame Law Review","90","1",""
"Svettsov V.V.","2002","Evaluating cometary delivery of organics to the early earth","Solar System Research","36","1","10.1023/A:1014225611296"
"Harlow H.D.","2019","Human capital and artificial intelligence (AL): Preparing for the singularity","Proceedings of the European Conference on Intellectual Capital","2019-May","",""
"Gerrand V.","2023","Young people, radicalisation, and resilience","Routledge Handbook of Violent Extremism and Resilience","","","10.4324/9781003267102-6"
"Moussawi A., Bakdash J.Z., Szymanski B.K., Korniss G., Lin X.","2017","Limits of Risk Predictability in a Cascading Alternating Renewal Process Model","Scientific Reports","7","1","10.1038/s41598-017-06873-x"
"Jouet M.","2019","Guns, identity, and nationhood","Palgrave Communications","5","1","10.1057/s41599-019-0349-z"
"Kaunda C.J.","2023","Mission as Withness","Expository Times","134","7","10.1177/00145246221132420"
"Knopov P.S.","2023","Optimization and Identification of Stochastic Systems*","Cybernetics and Systems Analysis","59","3","10.1007/s10559-023-00572-4"
"Eze-Okubuiro J.C., Nnawulez U., Ejembi P.A., Edeh O.J.","2023","DECONSTRUCTING THE RIGHT TO SELF-DETERMINATION AND THE POLEMICS OF SECESSION UNDER INTERNATIONAL LAW: THE CASE OF NIGERIA AND CAMEROON","African Journal of International and Comparative Law","31","2","10.3366/ajicl.2023.0448"
"Suter K.","2002","Progress in the international protection of human rights","Medicine, conflict, and survival","18","3","10.1080/13623690208409636"
"Andorra A.","2017","Keep calm and don't overreact. Le président Trump, le terrorisme et la menace existentielle","Revue Internationale et Strategique","107","3","10.3917/ris.107.0018"
"Hayward K.J., Maas M.M.","2020","Artificial intelligence and crime: A primer for criminologists","Crime, Media, Culture","","","10.1177/1741659020917434"
"Ríos R.H.","2023","Titanic Eschatology and Technological Apocalypse: The Drift of Éschaton in the Technification of the World","Revista Latinoamericana de Filosofia","49","1","10.36446/rlf2023357"
"Aliev V.A., Ramanazanly Z.Z., Akhmedov A.A., Makhmudov R.N.","2017","Morphometric and anthropogenic factors of flood risk in the Lower Kura","Water Resources","44","2","10.1134/S0097807817020075"
"Prochaska A.","2023","THE MONSTER INSIDE ME: 11 Dialogues about drastic aesthetics, the fictional monster, and boredom in the midst of the apocalypse","Atlantic Studies : Global Currents","","","10.1080/14788810.2023.2188875"
"Van Alst T.C.","2019","Occasionally, he's a somniaticidal maniac: Stephen Graham Jones reclaims home and history","Folia Linguistica et Litteraria","26","","10.31902/fll.26.2019.7"
"Ilgit A., Klotz A.","2014","How far does 'societal security' travel? Securitization in South African immigration policies","Security Dialogue","45","2","10.1177/0967010613519161"
"Dalyan T., Yıldırım S., Suerdem A.","2023","Detection of Change in the Senses of AI in Popular Discourse","Lecture Notes in Computer Science (including subseries Lecture Notes in Artificial Intelligence and Lecture Notes in Bioinformatics)","13397 LNCS","","10.1007/978-3-031-23804-8_4"
"Grange D.","2010","Far from the eyes of the world: Some dreams in the heart of addictive behaviors [Loin des yeux du monde: Quelques rêveries au cœur des conduites addictives]","Pensee Plurielle","23","1","10.3917/pp.023.0053"
"Kim E.","2023","The Art of the Trojan Catalogue (Iliad 2.816–877)","Classical World","116","2","10.1353/clw.2023.0000"
"Tsagdis G.","2023","On Ecologic Apocalypse: Biodegradation, Quantum Erasure, World","Metodo","10","2","10.19079/metodo.10.2.243"
"Rothe D.","2019","Governing the End Times? Planet Politics and the Secular Eschatology of the Anthropocene","Millennium: Journal of International Studies","","","10.1177/0305829819889138"
"Miranda Filho L.H., Rocha P.M.M., Santos D.D.A., Ribeiro B.V., De Sena N.C.","2020","Surviving the Zombie apocalypse: A population dynamics based approach","Revista Brasileira de Ensino de Fisica","42","","10.1590/1806-9126-RBEF-2020-0071"
"Gentithes M.","2020","Gobbledygook: Political questions, manageability, &amp; partisan gerrymandering","Iowa Law Review","105","3",""
"Jee S.H., Friedman E., Etzel R.A., Kemper K.J., Sack T.L., Nguyen V.T.","2023","Climate Change Imperils Pediatric Health: Child Advocacy Through Fossil Fuel Divestment","The Yale journal of biology and medicine","96","2","10.59249/ZODD9375"
"Quddoos M.U., Saud S., Xia E., Haseeb A., Usman M.","2023","Unveiling the liaison between human capital, trade openness, and environmental sustainability for BRICS economies: Robust panel-data estimation","Natural Resources Forum","","","10.1111/1477-8947.12277"
"Klein R.","2013","Climate change through the lens of Nuclear Criticism","Diacritics","41","3","10.1353/dia.2013.0015"
"Gupta P.M., Tejan P.K., Salpekar M.","2020","Smart Water Distribution Using Low Cost Communication Protocol","Lecture Notes in Electrical Engineering","580","","10.1007/978-981-32-9119-5_23"
"Wu J., O’Connor C.","2023","How should we promote transient diversity in science?","Synthese","201","2","10.1007/s11229-023-04037-1"
"Van Der Zweerde E.","2019","A hundred years that troubled the soul... The October revolution as a sacred object","Gosudarstvo, Religiia, Tserkov' v Rossii i za Rubezhom/State, Religion and Church in Russia and Worldwide","37","1-2","10.22394/2073-7203-2019-37-1/2-643-669"
"Lauta K.C.","2014","Disaster law","Disaster Law","","","10.4324/9781315867670"
"Scheffer M., Ciobanu D., Pedde S., Zimm C., Xu C., Xiao C., Gupta J., Armstrong McKay D.I., Zafra-Calvo N., Kanie N., Obura D., Verburg P.H., Qin D., Bala G., Liverman D.M., Mohamed A., DeClerck F., Ebi K., Gifford L., Hasan S., Bringezu S., Zhang X., Nakicenovic N., Rockström J., Gordon C., Tharammal T., van Vuuren D., Scholtens J., Winkelmann R., de Vries W., Ospina D., Bai X., Rammelt C., Sakschewski B., Loriani S., Lenton T.M., Green P.A., Xu X., Abrams J.F., Bennett E.M., Andersen L.S., Stewart-Koster B., Huang L., Schulte-Uebbing L., Jacobson L., Prodani K., Ndehedehe C., Broadgate W., Lade S.J., Rocha J., Bunn S.E.","2023","Safe and just Earth system boundaries","Nature","","","10.1038/s41586-023-06083-8"
"Dyring R.","2020","The futures of ‘us’: A critical phenomenology of the aporias of ethical community in the Anthropocene","Philosophy and Social Criticism","","","10.1177/0191453720916511"
"Renner M.","2001","Going to work for wind power. The renewable energy of the future is already beggining to generate new jobs to replace the ones that are disappearing in the energy sectors","World Watch","14","1",""
"Domańska-Szaruga B.","2020","Maturity of risk management culture","Entrepreneurship and Sustainability Issues","7","3","10.9770/jesi.2020.7.3(41)"
"Singh K.A.P., Rao S.","2023","Challenges of Space Debris and Space Drag: Building an International Climate Change Regime","Politics of Climate Change: Crises, Conventions and Cooperation","","","10.1142/9789811263750_0006"
"Davies M.L.","2012","Imprisoned by history: Aspects of historicized life","Imprisoned by History: Aspects of Historicized Life","","","10.4324/9780203863107"
"Helali C.","2023","Sacred Objects and Cosmic Justice in Indiana Jones","Indiana Jones and Philosophy: Why did it have to be Socrates?","","","10.1002/9781119740186.ch16"
"Denuit M., Lefèvre C., Utev S.","2002","Measuring the impact of dependence between claims occurrences","Insurance: Mathematics and Economics","30","1","10.1016/S0167-6687(01)00088-9"
"De Groeve T., Andredakis I.","2016","Towards a global humanitarian volcano impact alert model integrated into a multi-hazard system","Geological Society Special Publication","426","1","10.1144/SP426.10"
"Koplin J.J.","2023","Dual-use implications of AI text generation","Ethics and Information Technology","25","2","10.1007/s10676-023-09703-z"
"Imoedemhe D.G., Sigue A.B.","1992","Survival of human oocytes cryopreserved with or without the cumulus in 1,2-propanediol","Journal of Assisted Reproduction and Genetics","9","4","10.1007/BF01203954"
"Mathewson D.","2008","Verbal aspect in the Apocalypse of John: An analysis of revelation 5","Novum Testamentum","50","1","10.1163/156853607X186013"
"Levy D.L., Spicer A.","2013","Contested imaginaries and the cultural political economy of climate change","Organization","20","5","10.1177/1350508413489816"
"Bender S.","2023","Ethics for the future: Perspectives from 21st century fiction","Ethics for the Future: Perspectives from 21st Century Fiction","","","10.14361/9783839468203"
"Guitton M.J., Cristofari C.","2014","Surviving at any cost: Guilt expression following extreme ethical conflicts in a virtual setting","PLoS ONE","9","7","10.1371/journal.pone.0101711"
"Iliopoulos N., Esteban M.","2020","Sustainable space exploration and its relevance to the privatization of space ventures","Acta Astronautica","167","","10.1016/j.actaastro.2019.09.037"
"Champonnois V., Erdlenbruch K.","2021","Willingness of households to reduce flood risk in southern France","Journal of Flood Risk Management","","","10.1111/jfr3.12696"
"Ivic S.","2023","The United Nations Narrative of Climate Change: The Logic of Apocalypse","Cultura","20","1",""
"BUCHANAN D.A., HALLGREN M.","2020","The dark side of group behavior: Zombie apocalypse lessons","Academy of Management Perspectives","34","4","10.5465/AMP.2019.0007"
"Avilez J.","2023","Purple and blue: Memory, capitalism and ecological collapse in Flores","Short Film Studies","13","1","10.1386/sfs_00093_1"
"Li Y., Huai Y., Wang X., Wang M.","2019","Study on the Land Ecological Security and early warning in Shenzhen","IOP Conference Series: Earth and Environmental Science","300","3","10.1088/1755-1315/300/3/032068"
"Peters T.","2020","The Struggle for Cognitive Liberty: Retrofitting the Self in Activist Theology","Theology and Science","","","10.1080/14746700.2020.1786219"
"Turner B.S.","2023","A theory of catastrophe","A Theory of Catastrophe","","","10.1515/9783110772364"
"Egejuru G., Ejeromedoghene O., Ogunyemi O., Oladipo A., Adebayo A.","2023","A mini review on the prospects of Fagara zanthoxyloides extract based composites: A remedy for COVID-19 and associated replica?","Physical Sciences Reviews","","","10.1515/psr-2022-0256"
"Hartley J.","2023","Strategic stories: weaponized or worldmaking?","Global Media and China","8","1","10.1177/20594364231153200"
"Sailer K., Katzy B., Weber C.","2015","Real-time foresight - Preparedness for dynamic networks","Technological Forecasting and Social Change","101","","10.1016/j.techfore.2015.05.016"
"Hart E.M., Avilés L.","2014","Reconstructing local population dynamics in noisy metapopulations - The role of random catastrophes and Allee effects","PLoS ONE","9","10","10.1371/journal.pone.0110049"
"Minchev Z.","2020","Digital Society Future Transformation Perspectives in the Informational Age","Proceedings - 2020 IEEE 11th International Conference on Dependable Systems, Services and Technologies, DESSERT 2020","","","10.1109/DESSERT50317.2020.9125057"
"Verlie B.","2019","“Climatic-affective atmospheres”: A conceptual tool for affective scholarship in a changing climate","Emotion, Space and Society","33","","10.1016/j.emospa.2019.100623"
"Hafezi R., Asemi P.","2023","Global scenarios under crises: the case of post COVID-19 era","Foresight","25","4","10.1108/FS-12-2021-0248"
"Attoe A.D.","2023","Death and meaning(lessness): re-examining the African view","Religious Studies","59","2","10.1017/S0034412522000415"
"Johnson R.","2019","The nuclear ban treaty and humanitarian strategies to eliminate nuclear threats","Nuclear Disarmament: A Critical Assessment","","","10.4324/9780429026126-6"
"Collins J.","2019","Not one world but two. The future in jewish apocalyptic literature","Religions","10","4","10.3390/rel10040233"
"Leahy S.M., Ward F., Holland C.","2019","The digital frontier: Envisioning future technologies impact on the classroom","Futures","","","10.1016/j.futures.2019.04.009"
"Yampolskiy R.V.","2014","Utility function security in artificially intelligent agents","Journal of Experimental and Theoretical Artificial Intelligence","26","3","10.1080/0952813X.2014.895114"
"Sealey-Huggins L.","2017","‘1.5°C to stay alive’: climate change, imperialism and justice for the Caribbean","Third World Quarterly","38","11","10.1080/01436597.2017.1368013"
"Svitlana B., Lukianykhin V., Gumennykova T., Moskalenko O., Ruda O.","2023","Contemporary Challenges for Higher Education Applicants in Ukraine: A Philosophical and Attitudinal Aspect","Journal of Higher Education Theory and Practice","23","8","10.33423/jhetp.v23i8.6075"
"Preston J.L., Shin F.","2020","Anthropocentric Biases in Teleological Thinking: How Nature Seems Designed for Humans","Journal of Experimental Psychology: General","","","10.1037/xge0000981"
"Biancotti J.C., Narwani K., Mandefro B., Golan-Lev T., Buehler N., Hill D., Svendsen C.N., Benvenisty N.","2012","The in vitro survival of human monosomies and trisomies as embryonic stem cells","Stem Cell Research","9","3","10.1016/j.scr.2012.07.002"
