"Authors","Year","Title","Journal","Volume","Issue","DOI"
"Güven F., Keskinbora K.","2020","Artificial intelligence and ophthalmology","Turkish Journal of Ophthalmology","50","1","10.4274/tjo.galenos.2020.78989"
"Inambao F.L., Ebhota W.S.","2016","Electricity insufficiency in Africa: A product of inadequate manufacturing capacity","African Journal of Science, Technology, Innovation and Development","8","2","10.1080/20421338.2016.1147206"
"Cannavò P.F.","2019","Vulnerability and non-domination: a republican perspective on natural limits","Critical Review of International Social and Political Philosophy","","","10.1080/13698230.2019.1698155"
"Burunat E.","2019","Love is a physiological motivation (like hunger, thirst, sleep or sex)","Medical Hypotheses","129","","10.1016/j.mehy.2019.05.011"
"Novickytė L.","2019","Risk in agriculture: An overview of the theoretical insights and recent development trends during last decade – a review","Agricultural Economics (Czech Republic)","65","9","10.17221/11/2019-AGRICECON"
"Carter R.W., Sanford J.C.","2012","A new look at an old virus: Patterns of mutation accumulation in the human H1N1 influenza virus since 1918","Theoretical Biology and Medical Modelling","","","10.1186/1742-4682-9-42"
"Pavlenkova N.I.","2020","Petrophysical Features of the Upper Mantle Structure beneath Northern Eurasia and Their Nature","Petrology","28","3","10.1134/S0869591120030042"
"Smil V.","2017","Energy and civilization: A history","Energy and Civilization: A History","","",""
"Burke P.","2023","IGNORANCE: A GLOBAL HISTORY","Ignorance: A Global History","","",""
"Liu M., Zhao L., Zhao Y., Cui J.","2020","Progress on Terpenoids With Biological Activities Produced by Plant Endophytic Fungi in China Between 2017 and 2019","Natural Product Communications","15","7","10.1177/1934578X20937204"
"Keller S., Sullivan S.S., Thrane S.E., Wright P.M., Isaacson M.J., Kates J., Rosa W.E., James R., Mooney-Doyle K., Tanner J., Boyden J.Y., Hinds P.S., Tay D., Natal M., Coats H., Broden E.G., Xu J., Mayahara M., Doyon K., Frechman E.","2023","The 2023-2026 Hospice and Palliative Nurses Association Research Agenda","Journal of Hospice and Palliative Nursing","25","2","10.1097/NJH.0000000000000935"
"Simsekler M.C.E., Formaneck S., Qazi A.","2023","Supply chain risk network value at risk assessment using Bayesian belief networks and Monte Carlo simulation","Annals of Operations Research","322","1","10.1007/s10479-022-04598-3"
"Li X., Wang H., Zhang Y.","2017","Model research for regional architecture planning of distributed comprehensive energy based on energy Plus energy consumption simulation engine","Revista de la Facultad de Ingenieria","32","15",""
"Wang D., Zhang Y., Wang Y., Zhong X., Song W., Shao Z.","2017","Experimental study of the self-potential anomaly caused by coal fires","Journal of Applied Geophysics","145","","10.1016/j.jappgeo.2017.08.003"
"Grossi B.","2020","The ecstasy and the project. Notes about the end of the world","Acta Poetica","41","2","10.19130/IIFL.AP.2020.41.2.0002"
"Siemaszko K.","2020","Perpetrators and victims. Sex crime on the territory of middle Odra region in the early years after the world war ii","Journal on European History of Law","11","1",""
"Eschler E.","2020","In the Valley of the Shadow of Death: Insecurity and Miraculous Experiences","Review of Religious Research","","","10.1007/s13644-020-00419-w"
"Caballes C.F., Pacey K.I., Pratchett M.S.","2023","Using size-weight relationships to estimate biomass of heavily targeted aquarium corals by Australia’s coral harvest fisheries","Scientific Reports","13","1","10.1038/s41598-023-28447-w"
"Cooper C.L.","2005","The future of work: Careers, stress and well-being","Career Development International","10","5 SPEC. ISS.","10.1108/13620430510615319"
"Wang Z., Hu Y., Xu J., Wang S., Bhuiyan M.Z.A.","2023","Cooperative Location-Sensing Network Based on Vehicular Communication Security Against Attacks","IEEE Transactions on Intelligent Transportation Systems","24","1","10.1109/TITS.2022.3160453"
"Hameed S.O., Morgan L.E., Devillers R., Cornick L.A.","2017","Incentivizing more effective marine protected areas with the global ocean refuge system (GLORES)","Frontiers in Marine Science","4","JUN","10.3389/fmars.2017.00208"
"Ali G., Shivakoti G.P., Ullah R.","2015","Factors effecting farmers' risk attitude and risk perceptions: THE case of Khyber Pakhtunkhwa, Pakistan","International Journal of Disaster Risk Reduction","13","","10.1016/j.ijdrr.2015.05.005"
"Vinnikova I., Pavlov A., Kindaev A., Kuznetsova E.","2016","Crop insurance as a means of increasing efficiency of agricultural production in Russia","International Journal of Environmental and Science Education","11","18",""
"Panahi M., Rezaie F.","2015","GIS modeling of seismic vulnerability of residential fabrics considering geotechnical, structural, social and physical distance indicators in Tehran using multi-criteria decision-making techniques","Natural Hazards and Earth System Sciences","15","3","10.5194/nhess-15-461-2015"
"Astarlioglu S., Marjanishvili S.","2016","Uncertainties in predicting structural disproportionate collapse","American Concrete Institute, ACI Special Publication","2016-January","SP 309",""
"Khan W.A.","2023","Modeling of modified Eyring–Powell nanofluid flow subject to thermal-solutal stratification phenomenon","Proceedings of the Institution of Mechanical Engineers, Part E: Journal of Process Mechanical Engineering","","","10.1177/09544089231157522"
"Konkolÿ Thege B., Callanan J., Askland K.D., Emmanuel T.","2023","Trans-diagnostic determinants of psychotherapeutic treatment response: The pressing need and new opportunities for a more systematic way of selecting psychotherapeutic treatment in the age of virtual service delivery","Frontiers in Public Health","11","","10.3389/fpubh.2023.1102434"
"Huang D., Han B.L., Hu X.J., Tian J.P., Luo H.B., Tong W.H., Zhu M.","2020","Application of hyperspectral technology in detection of agricultural products and food: A Review","Food Science and Nutrition","","","10.1002/fsn3.1852"
"Gong C., Kalia V.C.","2023","Microbial Valorization of Food Wastes to Value-Added Products","Microbial Bioprocessing of Agri-Food Wastes: Industrial Applications","","","10.1201/9781003128984-1"
"Renčko A., Dvořák P., Falis M., Beňová K., Špalková M.","2015","Study of interaction of low doses of ionizing radiation with selected pesticides on Artemia franciscana","Acta Veterinaria Brno","84","1","10.2754/avb201585010037"
"Ogbazghi P.B.","2019","State absolutism and moral agency in the political philosophy of Thomas Hobbes and Niccolò Machiavelli: Implications for Eritrea","African Studies Quarterly","18","3",""
"Sorentino S.M.","2023","Abolish the Oikos Notes on Incapacity from Antiquity to Marxist Feminism, Black Feminism, and Afro-pessimism","Qui Parle: Critical Humanities and Social Sciences","32","1","10.1215/10418385-10427992"
"Lakra S., Sharma Y.","2020","Green Cloud Job Scheduling and Load Balancing Using Hybrid Biogeography Based Optimization and Genetic Algorithm: A Proposed Approach","Lecture Notes in Networks and Systems","106","","10.1007/978-981-15-2329-8_19"
"Refsland T.K., Miesel J.R., Adams B., Bronson D., McGraw A.M., Royo A.A., Kern C.C., Marquardt P.","2023","Synthesis of plant-soil feedback effects on eastern North American tree species: implications for climate-adaptive forestry","Frontiers in Ecology and Evolution","11","","10.3389/fevo.2023.1073724"
"Rossi S.","2023","Regressive (Im)Mutability and Human Degeneration in Samuel Beckett’s Endgame and Wilfred R. Bion’s The Dawn of Oblivion","American Imago","80","2","10.1353/aim.2023.a901548"
"Ghosn M., Miao F.","2017","Reliability-Based Dynamic Analysis of Progressive Collapse of Highway Bridges","Procedia Engineering","199","","10.1016/j.proeng.2017.09.300"
"De Austria Gimenez De Aragon A.M.R.","2016","«We don't eat people»: How the post-apocalyptic cinema of the 21st century teach us the new ethics of the cannibalistic system","Daimon","2016","","10.6018/daimon/269071"
"Mesch G.S., Liu X.J.","2020","The adoption of preventive behaviors during the COVID-19 pandemic in China and Israel","International Journal of Environmental Research and Public Health","17","19","10.3390/ijerph17197170"
"Ghasemi S., Salahshoori I., Khonakdar H.A., Namayandeh Jorabchi M., Golriz M., Wohlrab S.","2023","Advancements in wastewater Treatment: A computational analysis of adsorption characteristics of cationic dyes pollutants on amide Functionalized-MOF nanostructure MIL-53 (Al) surfaces","Separation and Purification Technology","319","","10.1016/j.seppur.2023.124081"
"Joe Patrick Gnanaraj S., Ramachandran S., Mageshwaran G.","2016","Experimental analysis of single basin solar still with internal reflector and sensible heat storage medium","International Journal of ChemTech Research","9","8",""
"Faber R.","2019","Moderne Gnosis, jenseits von Christen-wie Judentum: Anmerkungen zu und Erinnerungen an Jacob Taubes, aus Anlass des von Herbert Kopp-Oberstebrink und Martin Treml herausgegebenen Aufsatzbandes ŽApokalypse und Politik""","Zeitschrift fur Religions- und Geistesgeschichte","71","3","10.1163/15700739-07103002"
"Bifulco M., Marano A., Avilia G., Pagano G., Trifuoggi M., Pagano C., Laezza C., Navarra G., Savarese B., Coppola L., Giarra A.","2023","Impacts of Environmental Pollution on Brain Tumorigenesis","International Journal of Molecular Sciences","24","5","10.3390/ijms24055045"
"Boyden M.","2016","Outlandish Apocalyptics and Creaturely Life in Nathaniel Hawthorne's 'My Kinsman, Major Molineux'","Studia Neophilologica","88","","10.1080/00393274.2015.1096035"
"Vinson J.H.","2013","Communication(s) and technology in spectrum implementation with body earth","2013 1st IEEE Conference on Technologies for Sustainability, SusTech 2013","","","10.1109/SusTech.2013.6617323"
"Bazinet R.P., Sidhu M., Malik V., Jenkins D.J., Carey C.N., Khodabandehlou K., Wanyan J., Dadvar A., Hanley A.J., Tandon S., Dinh D., Liang F., Sahye-Pudaruth S., Paquette M., Mishra E., Sievenpiper J.L., Brown R.","2023","The Environmental Sustainability of Plant-Based Dietary Patterns: A Scoping Review","Journal of Nutrition","153","3","10.1016/j.tjnut.2023.02.001"
"Jiang Y., Yang F.","2023","Comparison of forest ecosystem services value evaluation methods: a case study of Sichuan Province, China","Ciencia Rural","53","1","10.1590/0103-8478cr20201075"
"Maraschi A.C., Romero M.C., McNamara J.C., Tapella F.","2023","Evolutionary trade-offs in osmotic and ionic regulation and expression of gill ion transporter genes in high latitude, cold clime Neotropical crabs from the ‘end of the world’","Journal of Experimental Biology","226","5","10.1242/jeb.244129"
"Huang J.S., Li J.","2020","Dimensions of artificial intelligence anxiety based on the integrated fear acquisition theory","Technology in Society","63","","10.1016/j.techsoc.2020.101410"
"Zhou M.","2015","Adapting sustainable forest management to climate policy uncertainty: A conceptual framework","Forest Policy and Economics","59","","10.1016/j.forpol.2015.05.013"
"de Souza N.S., Oliveira J.M.d.S., Mousinho K.C., Parolia A., do Nascimento T.G., dos Santos A.F., Barreto F.S., Basílio-Júnior I.D., Porto I.C.C.d.M., de Mendonça I.C.G., Arruda R.E.d.S.","2015","Brazilian red propolis: Phytochemical screening, antioxidant activity and effect against cancer cells","BMC Complementary and Alternative Medicine","15","1","10.1186/s12906-015-0888-9"
"Kamal M.S., Yu W., Wu Y.S., Zhou X., Elsayed M., Khan S.Z., Al-Abdrabalnabi R.","2023","Experimental Study on Supercritical CO2 Enhanced Oil Recovery and its Sequestration Potential with Different injection Modes for Carbonate Oil Reservoirs Under Reservoir Conditions","SPE Western Regional Meeting Proceedings","2023-May","","10.2118/212992-MS"
"Hoodbhoy P.","2023","PAKISTAN: Origins, Identity and Future","Pakistan: Origins, Identity and Future","","","10.4324/9781003379140"
"Mu L., Yan X., Fang L.","2019","How does the water-energy-food nexus work in developing countries? An empirical study of China","Science of the Total Environment","","","10.1016/j.scitotenv.2019.134791"
"Skibniewski M.J., Wei H.H., Shohet I.M., Yao X.","2017","Public-private partnership for earthquake mitigation involving retrofit and insurance","Technological and Economic Development of Economy","23","6","10.3846/20294913.2015.1075443"
"Soban D., Best R., Smyth B.M., Harris A.","2020","A probabilistic fleet analysis for energy consumption, life cycle cost and greenhouse gas emissions modelling of bus technologies","Applied Energy","261","","10.1016/j.apenergy.2019.114422"
"Pons D.J.","2019","Alignment of the safety assessment method with New Zealand legislative responsibilities","Safety","5","3","10.3390/safety5030059"
"Pye S.","2020","Killing the Silent Witness: The Benefits of an Authorial Stance as Interpreter in Future-focused Natural Biography","Life Writing","","","10.1080/14484528.2020.1795979"
"Bermejo F., Moya-Martínez P., del Pozo-Rubio R.","2020","Hard times for long-term care systems? Spillover effects on the Spanish economy","Economic Systems Research","","","10.1080/09535314.2020.1752627"
"Willy C., Gallop D., Bischoff J.","2016","How to catch a black swan: Measuring the benefits of the premortem technique for risk identification","Journal of Enterprise Transformation","6","2","10.1080/19488289.2016.1240118"
"Kim Y.","2020","Outbreak news production as a site of tension: Journalists’ news-making of global infectious disease","Journalism","","","10.1177/1464884920940148"
"He J.","2020","Impact of Water-Saving Renovation Projects on the Environment","Journal of Physics: Conference Series","1549","2","10.1088/1742-6596/1549/2/022022"
"Sorokina M., Schabel C.","2016","LE Feu brulera-T-Il L'étoupe ? Guiral ot sur l'influence céleste À la fin des temps","Archives d'Histoire Doctrinale et Litteraire du Moyen-Age","83","1","10.3917/ahdlm.083.0211"
"Duncan J., Myers R.J.","2000","Crop insurance under catastrophic risk","American Journal of Agricultural Economics","82","4",""
"Marklund C.","2019","Double Loyalties?: Small-State Solidarity and the Debates on New International Economic Order in Sweden During the Long 1970s","Scandinavian Journal of History","","","10.1080/03468755.2019.1624606"
"Pal H., Singh T.","2023","Assessment of Seven Conventional Natural Drinking Water Sources in the Periphery of Chamba Town of Himachal Pradesh in India","Asian Journal of Water, Environment and Pollution","20","1","10.3233/AJW230013"
"Chen H.R., Lee C.W., Wang K., Mardones D., Wu Y., Li D., Liu S.Y., Liu T., Lee J.E., Qin S.L., Cho S.H., Zhang Q., Kim K.T., Goldsmith P.F., Tatematsu K.","2016","DISCOVERY of AN EXTREMELY WIDE-ANGLE BIPOLAR OUTFLOW in AFGL 5142","Astrophysical Journal","824","1","10.3847/0004-637X/824/1/31"
"Zhang H., Zeng Y., Tian L., Han L., Zhang J.","2019","Selective Oil/Water Separation Materials","Progress in Chemistry","31","1","10.7536/PC180447"
"Zhang Y., Li X., Chen A., Liu M., Zhang Q., Chai Z.","2023","Dense Temperature Mapping and Heat Wave Risk Analysis based on Multi-source Remote Sensing Data","IEEE Journal of Selected Topics in Applied Earth Observations and Remote Sensing","","","10.1109/JSTARS.2023.3260467"
"Hayes F.E., Engbring J.","2020","Historic and recent status of the Kosrae flying fox (Pteropus ualanus) on Kosrae, Micronesia","Journal of Asia-Pacific Biodiversity","","","10.1016/j.japb.2020.02.008"
"Fisher P.","1956","A Forgotten Gentry of the Fourth Estate","Journalism & Mass Communication Quarterly","33","2","10.1177/107769905603300202"
"Van der Poll H.M., Nkwaira C.","2023","Anticipating the Unforeseen and Expecting the Unexpected: Effectiveness of Macro-Prudential Policies in Curbing the Impact of Stranded Assets in the Banking Sector","Risks","11","5","10.3390/risks11050087"
"Nasheed M.","2013","Democracy and Sustainable Development","Democracy, Sustainable Development, and Peace: New Perspectives on South Asia","","","10.1093/acprof:oso/9780198092346.003.0023"
"Islam S.N.u., Asgher M., Khan N.A., Arshad M., Rehaman A.","2023","Appraisal of Functions and Role of Selenium in Heavy Metal Stress Adaptation in Plants","Agriculture (Switzerland)","13","5","10.3390/agriculture13051083"
"Komac B., Gašperič P.","2019","Remapping Fictional Worlds: A Comparative Reconstruction of Fictional Maps","Cartographic Journal","","","10.1080/00087041.2019.1629168"
"González R.J.","2015","Seeing into hearts and minds: Part 1. The Pentagon's quest for a 'social radar'","Anthropology Today","31","3","10.1111/1467-8322.12174"
"Carnahan H., Riccardelli R.","2023","Ethnographic and lived experience of cold-water immersion: The compromised survival of women at sea due to ill-fitting immersion suits","Journal of Maritime Research","20","1",""
"Abraham A., Amaratunga D., Ubarte I., Kaklauskas A., Kaklauskaite U., Lill I., Milevicius V., Kaklauskiene L.","2023","Synergy of climate change with country success and city quality of life","Scientific Reports","13","1","10.1038/s41598-023-35133-4"
"Glass C.R., Cruz N.I.","2023","Failure is not an option: Entrepreneurship and the existential crisis of internationalization in the U.S.","Higher Education Quarterly","77","2","10.1111/hequ.12396"
"Rana A.K., Kumar N.","2023","Current wildlife crime (Indian scenario): major challenges and prevention approaches","Biodiversity and Conservation","32","5","10.1007/s10531-023-02577-z"
"Kumar D., Aisha S., Mufti T., Khan I.R.","2023","A Systematic Review on Deepfake Technology","Lecture Notes in Networks and Systems","572","","10.1007/978-981-19-7615-5_55"
"Bertasio D.","2020","The old doom of a new technology","AI and Society","","","10.1007/s00146-020-00986-0"
"Goumas G., Peppas A., Giannoula C., Koziris N.","2023","High-performance and balanced parallel graph coloring on multicore platforms","Journal of Supercomputing","79","6","10.1007/s11227-022-04894-6"
"Drechsel A.","2019","Technology literacy for the interpreter","American Translators Association Scholarly Monograph Series","19","","10.1075/ata.xix.12dre"
"Baker N.","2023","“This Sad Time”: The Augustinian Temporality of King Lear","Modern Philology","120","3","10.1086/722806"
"Lopez L.A., Komarek T., D'Lima W.","2023","Risk perception in housing markets: Evidence from a fighter jet crash","Real Estate Economics","","","10.1111/1540-6229.12432"
"Cano E.L., Yermoliev Y., Moguerza J.M., Ermolieva T.","2017","A strategic decision support system framework for energy-efficient technology investments","TOP","25","2","10.1007/s11750-016-0429-9"
"Ureña L.G.","2015","Colour adjectives in the new testament","New Testament Studies","61","2","10.1017/S0028688514000356"
"Carola C.R., de Mattia Buogo I.","2023","The End of Modern Civilization and Humankind’s Formative Path in the Post-Apocalyptic World Imagined by Western Literature (1800-1950)","Historia Ambiental Latinoamericana y Caribena","13","1","10.32991/2237-2717.2023v13i1.p114-144"
"Packard M.D., Clark B.B., McBride R.","2023","Rogue Entrepreneurship","Entrepreneurship: Theory and Practice","","","10.1177/10422587221135763"
"Li S., Faure M.","2020","Risk shifting in the context of 3D printing: an insurability perspective","Geneva Papers on Risk and Insurance: Issues and Practice","","","10.1057/s41288-020-00164-9"
"Arvindan S., Maruthachalam D., Ranjith Kumar R., Manoharan K., Vijayan D.S.","2023","Damage Assessment and Health Monitoring of Timber Structures Using SHM Techniques","AIP Conference Proceedings","2523","","10.1063/5.0109846"
"Pempel T.J.","2019","Right target; wrong tactics: the trump administration upends East Asian order","Pacific Review","","","10.1080/09512748.2019.1617769"
"Bertsch K., Herpertz S.C., Nüssel F., Roth C., Ueltzhöffer K., Neukel C.","2023","Do I care for you or for me? Processing of protected and non-protected moral values in subjects with extreme scores on the Dark Triad","European Archives of Psychiatry and Clinical Neuroscience","273","2","10.1007/s00406-022-01489-3"
"Sornette D., Wu K.","2023","Coupled system approach to healthy earth environments and individual human resilience","Sustainable Horizons","5","","10.1016/j.horiz.2023.100050"
"Bachmann O., Geshi N., Miyakawa A., Keller F., Guillong M.","2023","Tracking caldera cycles in the Aso magmatic system – Applications of magnetite composition as a proxy for differentiation","Journal of Volcanology and Geothermal Research","436","","10.1016/j.jvolgeores.2023.107789"
"Abdi A., Taghipour S.","2019","Forecasting carbon price in the Western Climate Initiative market using Bayesian networks","Carbon Management","","","10.1080/17583004.2019.1589842"
"Plum H.","2020","“I planted the sun in the middle of the sky like a flag”: In and of etel adnan's arab apocalypse","College Literature","47","3","10.1353/lit.2020.0025"
"Omar A.H., Hamden M.H., Adzmi N.H.M., Zulkifli N.A., Din A.H.M., Arif M.I.","2023","ASSESSMENT OF SEA LEVEL RISE IMPACT ON PENINSULAR MALAYSIA GEODETIC VERTICAL DATUM","International Archives of the Photogrammetry, Remote Sensing and Spatial Information Sciences - ISPRS Archives","48","4/W6-2022","10.5194/isprs-archives-XLVIII-4-W6-2022-25-2023"
"De Guttry A.","2020","Is the International Community Ready for the Next Pandemic Wave? A Legal Analysis of the Preparedness Rules Codified in Universal Instruments and of their Impact in the Light of the COVID-19 Experience","Global Jurist","","","10.1515/gj-2020-0038"
"Bullock S., Johnson A., Potts M.W.","2020","Evaluating the complexity of engineered systems: A framework informed by a user case study","Systems Engineering","","","10.1002/sys.21558"
"Le Gall M., Taliaferro C.","2008","The recovery of childhood and the search for the absent father","Steven Spielberg and Philosophy: We're Gonna Need A Bigger Book","","",""
"Allegrucci G., Trewick S.A., Fortunato A., Carchini G., Sbordoni V.","2010","Cave crickets and cave weta (Orthoptera, Rhaphidophoridae) from the Southern End of the World: A molecular phylogeny test of biogeographical hypotheses","Journal of Orthoptera Research","19","1","10.1665/034.019.0118"
"Silva-Buston C., Raykov R.","2020","Holding company affiliation and bank stability: Evidence from the US banking sector","Journal of Corporate Finance","65","","10.1016/j.jcorpfin.2020.101739"
"Yamawaki S., Okada G., Okamoto Y., Liberzon I.","2012","Mood dysregulation and stabilization: Perspectives from emotional cognitive neuroscience","International Journal of Neuropsychopharmacology","15","5","10.1017/S1461145711000757"
"Wenzel M., Lange F., Nielsen K.S., Rowland Z.","2023","The impact of perceived threat and perceived coping efficacy on individual actions toward biodiversity conservation: a registered report","Journal of Environmental Psychology","88","","10.1016/j.jenvp.2023.102038"
"Benarde M.A.","2006","Our Precarious Habitat ... It's In Your Hands","Our Precarious Habitat ... It's In Your Hands","","","10.1002/9780470099704"
"Bin Muhammad Yusoff M.F., Ismail M.Y.","2023","Sunni Ḥadīth and Continuous Commentaries on the Eschatological Mahdī: A Literary Analysis","Religions","14","4","10.3390/rel14040499"
"Guillebaud J., Greguš J.","2020","Doctors and overpopulation 48 years later: a second notice","European Journal of Contraception and Reproductive Health Care","","","10.1080/13625187.2020.1821356"
"Schmid B.","2019","Degrowth and postcapitalism: Transformative geographies beyond accumulation and growth","Geography Compass","","","10.1111/gec3.12470"
"Wittkowski J.","2016","Coping and attitudes toward dying and death in German adults","Omega (United States)","72","4","10.1177/0030222815575283"
"Grossklags J., Reitter D.","2019","The positive impact of task familiarity, risk propensity, and need for cognition on observed timing decisions in a security game","Games","10","4","10.3390/g10040049"
"Rahman M.A.","2019","Application of Bayesian Methods in Disaster Risk Assessment","2019 IEEE 6th International Conference on Industrial Engineering and Applications, ICIEA 2019","","","10.1109/IEA.2019.8714913"
"Bowden V., Nyberg D., Wright C.","2021","“I don’t think anybody really knows”: Constructing reflexive ignorance in climate change adaptation","British Journal of Sociology","","","10.1111/1468-4446.12818"
"Ayu M., Amri R.Y., Putra R.S.","2020","Turbidity removal of synthetic wastewater using biocoagulants based on protein and tannin","AIP Conference Proceedings","2242","","10.1063/5.0007846"
"Woldense J., Kroeger A.","2023","Elite Change without Regime Change: Authoritarian Persistence in Africa and the End of the Cold War","American Political Science Review","51","3","10.1017/S0003055423000151"
"Häberle H., Schwarz R., Mathes L.","1997","Family orientated interventions of children and adolscents with cancer disease [Familienorientierte betreuung bei krebskranken kindern und jugendlichen]","Praxis der Kinderpsychologie und Kinderpsychiatrie","46","6",""
"Boyd C., Parr H., Philo C.","2023","Climate anxiety as posthuman knowledge","Wellbeing, Space and Society","4","","10.1016/j.wss.2022.100120"
"Stiebritz M.T., Tellechea-Luzardo J., Carbonell P.","2023","Transcription factor-based biosensors for screening and dynamic regulation","Frontiers in Bioengineering and Biotechnology","11","","10.3389/fbioe.2023.1118702"
"Qing Y., Wu J., Wang C.L., Wang J., Gu Z.","2020","Analytical and experimental studies on buckling-restrained brace with gap-supported tendon protection","Journal of Constructional Steel Research","164","","10.1016/j.jcsr.2019.105807"
"Tyszka T., Michailova J.","2019","Dispositional Factors Affecting Choices Surrounding the Purchase of Insurance and the Taking of Mitigating Measures Against Flooding","Risk Analysis","","","10.1111/risa.13441"
